{
  "program_id": "11111111-1111-4111-8111-111111111111",
  "run_id": "77777777-7777-4777-8777-777777777777",
  "trace_refs": [
    "88888888-8888-4888-8888-888888888888"
  ],
  "outcome": {
    "status": "partial",
    "summary": "The synthetic run completed its contract checks but did not execute M6 learning."
  },
  "error_refs": []
}
